{
  "object": {
    "classConfidence": 95,
    "classification": 5,
    "measurementDeltaTime": -50,
    "objectId": 7,
    "position": {
      "x": 3000,
      "xConfidence": 90,
      "y": 0,
      "yConfidence": 90
    },
    "velocity": {
      "x": 1520,
      "y": 0
    }
  },
  "orientationAngle": 900,
  "referencePosition": {
    "latitude": 210285110,
    "longitude": 1058048170
  },
  "referenceTime": 716084805123,
  "stationId": 1201
}
